question,answer
"I have geographic atrophy, what does this mean?","  Geographic atrophy is when retinal cells gradually die (atrophy), leading to patches of ‘missing’ retina and loss of central vision. This occurs in the late dry stage of age-related macular degeneration."
" I have noticed changes to my vision when using the Amsler grid, what should I do?","If you notice any sudden changes to your vision when using an Amsler grid it is critical that you advise your health care professional (optometrist or ophthalmologist) immediately and make an appointment to have your eyes tested and your macula checked. When making the appointment, state that you have had a sudden change in vision. If you are given an appointment which is more than a week away, ask for it to be sooner. Intermediate or late stage dry AMD can turn into wet AMD very quickly and delays in seeking treatment can lead to loss of sight."
Is exercise good for age-related macular degeneration?,"MDFA advises that regular exercise is good not only for your general health and wellbeing but there is also evidence that people who exercise regularly are less likely to progress to late-stage disease. In addition, exercise is important for your emotional wellbeing. "
I have vision loss from age-related macular degeneration and cataracts. Will cataract surgery be of any use?,"In people with severe AMD, most central vision is lost and the person is very dependent on their peripheral vision. If these people also have significant cataracts, cataract surgery can significantly improve the quality of peripheral vision. Several studies have shown that in people who have significant cataracts and severe AMD, cataract surgery can produce major improvements in overall quality of life, even if central vision is not improved. In contrast, people with severe AMD and mild cataracts do not usually benefit greatly from cataract surgery."
Does cataract surgery increase the risk of macular disease progression?,"Cataracts and AMD are common eye conditions that can affect older people at the same time. Some studies and anecdotal reports suggest that cataract surgery may accelerate the progression of AMD. Other studies have shown no link. On balance, cataract surgery does not appear to contribute to worsening of AMD.  In some people, dense cataracts can mask the symptoms of AMD. When a dense cataract is removed and replaced with a new intraocular lens, vision is usually much clearer meaning that the symptoms of AMD, such as distortion, can become more obvious. Some people have mistakenly concluded that the surgery made the AMD worse.  People with conditions such as 'wet' age-related macular degeneration may be receiving regular injections of an anti-VEGF drug to reduce the formation of unwanted new blood vessels and leakage under or within the retina. If these people also have significant cataracts, it is generally considered appropriate to delay cataract surgery until the new blood vessel formation and leakage has stabilised. Delaying cataract surgery will not have any negative impact on the outcome of the surgery."